2125,On-boarding activities for KF,40.0,0.0,0.44047619047619047,0.4413919413919414
2126,On-boarding activities for CM,40.0,0.0,0.44047619047619047,0.4413919413919414
2127,Rendering an IR node tree should produce properly parenthesized output,8.0,0.5743473325766175,0.027472527472527472,0.027472527472527472
2128,On-boarding activities for MR,40.0,0.0,0.44047619047619047,0.4413919413919414
2129,Add information on milestone relationships to DMTN-020,1.0,0.7582292849035187,1.0,1.0
2130,Add note to DMTN-020 covering onboarding work assigned to 00 WBS,1.0,0.7582292849035187,1.0,1.0
2131,Failure to identify location of clear supernova in a subtraction,8.0,0.09194097616345062,0.09615384615384616,0.09615384615384616
2132,Modify obs_subaru tests to support pytest,0.25,0.04767309875141884,0.020146520146520148,0.020146520146520148
2133,random seed not run in command line test,1.0,0.3337116912599319,0.2600732600732601,0.2600732600732601
2134,Fix missing rows in queries on the cluster,10.0,0.19182746878547105,0.09432234432234432,0.09432234432234432
2135,PEP8 Compliance for conda-lsst,0.5,0.13393870601589103,0.09706959706959707,0.09706959706959707
2136,Modify obs_lsstSim to support py.test,0.5,0.11577752553916004,0.09615384615384616,0.09615384615384616
2137,Make temporary workaround for DM-7377,0.1,0.3348467650397276,0.20238095238095238,0.20238095238095238
2138,Jenkins/lsstsw no longer seems to build optional dependencies in all cases,0.5,0.9897843359818388,0.7976190476190477,0.7994505494505495
2139,Modify obs_decam to support py.test,0.5,0.5675368898978433,0.09615384615384616,0.09615384615384616
2140,ConOps planning for Archiving,10.0,0.19977298524404086,0.14652014652014653,0.14652014652014653
2141,Create a public function to reset to the default mask planes,1.0,0.0,0.2600732600732601,0.2600732600732601
2142,Improve tests highly sensitive to random seeds,2.0,0.0,0.2600732600732601,0.2600732600732601
2143,Port obs_monocam to Python 3,1.0,0.5675368898978433,1.0,1.0
2144,More LDM-151 Review Updates,1.0,0.8286038592508513,0.9807692307692307,0.9807692307692307
2145,First pass through all services possessing Concepts of Operations to identify main components,8.0,0.15891032917139614,0.8745421245421245,0.9010989010989011
2146,Gather requirements from commissioning workshop,10.0,0.2122587968217934,0.8745421245421245,0.9010989010989011
2147,Create a suite of image subtraction test cases,8.0,0.0,0.09615384615384616,0.09615384615384616
2148,Add quasars to StarFast simulations,4.0,0.40408626560726446,0.4706959706959707,0.4697802197802198
2149,Add simulated galaxies to StarFast,6.0,0.40408626560726446,0.4706959706959707,0.4697802197802198
2150,make getTemplate selector for templates more robust,0.25,0.11577752553916004,0.09615384615384616,0.09615384615384616
2151,Implement abstract base class for approximated or interpolated fields,10.0,0.300794551645857,0.9807692307692307,0.9807692307692307
2152,Prepare for installation of OCS SAL code in prep for ConOps development,2.0,0.19977298524404086,0.8745421245421245,0.9010989010989011
2153,Review ConOps for Main Camera Archive Services,3.0,0.4108967082860386,0.27014652014652013,0.27014652014652013
2154,Discuss and Design workflow for archival model,4.0,0.4108967082860386,0.27014652014652013,0.27014652014652013
2155,Assemble design concepts into mock api,3.0,0.4108967082860386,0.27014652014652013,0.27014652014652013
2156,Add VOTable support when uploading table ,8.0,0.15664018161180476,0.10347985347985347,0.10256410256410256
2157,Create Light curve skeleton app,4.0,0.2383654937570942,0.07692307692307693,0.07875457875457875
2158,"Participate in LDM-151 meeting, 2016-08-29",1.0,0.8286038592508513,1.0,1.0
2159,"Participate in LDM-151 meeting, 2016-08-29",1.0,0.34506242905788875,1.0,1.0
2160,"Participate in LDM-151 meeting, 2016-08-29",1.0,0.06129398410896708,1.0,1.0
2161,"Participate in LDM-151 meeting, 2016-08-29",1.0,0.7582292849035187,1.0,1.0
2162,Review ConOps for Main Camera Archive Services,3.0,0.4108967082860386,0.27014652014652013,0.27014652014652013
2163,Discuss and Design workflow for archival model,4.0,0.4108967082860386,0.27014652014652013,0.27014652014652013
2164,Assemble design concepts into mock api,3.0,0.4108967082860386,0.27014652014652013,0.27014652014652013
2165,Port dax_dbserv to Python 3,0.5,0.12145289443813848,0.7976190476190477,0.7994505494505495
2166,Port dax_imgserv to Python 3,2.0,0.12145289443813848,0.7976190476190477,0.7994505494505495
2167,Port dax_metaserv to Python 3,0.5,0.12145289443813848,0.7976190476190477,0.7994505494505495
2168,Port dax_webserv to Python 3,0.5,0.12145289443813848,0.7976190476190477,0.7994505494505495
2169,Port dax_webservcommon to Python 3,0.5,0.12145289443813848,0.7976190476190477,0.7994505494505495
2170,Use geom eups package for installing geometry,3.0,0.4177071509648127,0.3543956043956044,0.3543956043956044
2171,Compile shortlist of technologies and draft requirements,4.0,0.06583427922814983,0.03205128205128205,0.03205128205128205
2172,Write up notes comparing existing candidate technologies,6.0,0.06583427922814983,0.03205128205128205,0.03205128205128205
2173,Rework joint photometric calibration in LDM-151,1.0,0.8286038592508513,0.9807692307692307,0.9807692307692307
2174,Port pipe_supertask to Python 3,1.0,0.15096481271282633,0.7976190476190477,0.7994505494505495
2175,Improve display of metric thresholds,4.0,0.7298524404086265,0.5576923076923077,0.5576923076923077
2176,Update pipe_tasks' testTransform to use catalogCalculation rather than afterburner,0.2,0.7582292849035187,1.0,1.0
2177,Publish LSE-163 to LSST the Docs,0.5,0.9125993189557321,0.6565934065934066,0.6538461538461539
2178,Get the Kafka quickstart running and dockerized with Colin's mini-alert code,4.0,0.06583427922814983,0.03205128205128205,0.03205128205128205
2179,Background research on existing VOEvent-based systems,6.0,0.06583427922814983,0.03205128205128205,0.03205128205128205
2180,Work through Kafka docs and tutorials,10.0,0.06583427922814983,0.03205128205128205,0.03205128205128205
2181,Create test case for processFile,2.0,0.11577752553916004,0.09615384615384616,0.09615384615384616
2182,Cleanup in admin/tools,2.0,0.4177071509648127,0.3543956043956044,0.3543956043956044
2183,Fix eupspkg command for qserv containers,2.0,0.4177071509648127,0.3543956043956044,0.3543956043956044
2184,Need an easier way to spot failing jobs ,2.0,0.7298524404086265,0.5576923076923077,0.5576923076923077
2185,Support Non-DM ticket editions with LTD Keeper,0.2,0.9125993189557321,0.6565934065934066,0.6538461538461539
2186,"Qserv release (12.04) - final build, testing and cutting release",4.0,0.5743473325766175,0.9459706959706959,0.5815018315018315
2187,Manage multiple bokeh apps ,5.0,0.7298524404086265,0.5576923076923077,0.5576923076923077
2188,Write unit tests for DCR template generation code,8.0,0.40408626560726446,0.4706959706959707,0.4697802197802198
2189,Write tech note describing the fitters and optimization techniques in the stack,4.0,0.0,0.4706959706959707,0.4697802197802198
2190,Improve jointcal plotting backend,8.0,0.5675368898978433,0.5009157509157509,0.5009157509157509
2191,DCR template generation speed improvements,8.0,0.40408626560726446,0.4706959706959707,0.4697802197802198
2192,Write tech note describing DCR algorithm and results,10.0,0.40408626560726446,0.4706959706959707,0.4697802197802198
2193,Run DCR template generation on real data,2.0,0.40408626560726446,0.4706959706959707,0.4697802197802198
2194,Table reset unset option 'Show unit' initially set,1.0,0.2383654937570942,0.10347985347985347,0.10256410256410256
2195,Add eups python_future dependency to galsim,0.5,0.13393870601589103,0.09706959706959707,0.09706959706959707
2196,Update coding standard to reflect non-executable tests (RFC-215),0.5,0.9897843359818388,0.5009157509157509,0.5009157509157509
2197,Build a sample alert with expected content without postage stamp,4.0,0.06583427922814983,0.03205128205128205,0.03205128205128205
2198,Extend sample alert to include postage stamp,6.0,0.06583427922814983,0.03205128205128205,0.03205128205128205
2199,Write alert producer with the Kafka framework,4.0,0.06583427922814983,0.03205128205128205,0.03205128205128205
2200,Write alert consumer with the Kafka framework,4.0,0.06583427922814983,0.03205128205128205,0.03205128205128205
2201,Scale up Kafka alert producers,5.0,0.06583427922814983,0.03205128205128205,0.03205128205128205
2202,Scale up Kafka alert consumers,2.0,0.06583427922814983,0.03205128205128205,0.03205128205128205
2203,daf_persistence 3e6e15d fails build,1.0,0.7582292849035187,0.09615384615384616,0.09615384615384616
2204,Cannot add base_GaussianFlux to the list of default plugins in DipoleFitTask.,2.0,0.09194097616345062,0.0695970695970696,0.0695970695970696
2205,Simplify (script) install procedure,3.0,0.4177071509648127,0.3543956043956044,0.3543956043956044
2206,No help link/anchor option XY-plot component,2.0,0.21112372304199772,0.10347985347985347,0.10256410256410256
2207,afw test suite fails in the absence of afwdata,0.5,0.9897843359818388,0.20238095238095238,0.20238095238095238
2208,Region selection issue,6.0,0.15664018161180476,0.023809523809523808,0.023809523809523808
2209,Repackage Firefly Python API in its own pip-installable repository,2.0,0.094211123723042,0.0695970695970696,0.06868131868131869
2210,Add requirement annotations to DPDD,20.0,0.9897843359818388,0.7976190476190477,0.7994505494505495
2211,Derive decorrelation expression in the case of science image preconvolution,4.0,0.09194097616345062,0.0695970695970696,0.0695970695970696
2212,Finish identifying requirements and associating them with use case examples from Jim & Simon,4.0,0.337116912599319,0.26373626373626374,0.2619047619047619
2213,Work on Swift Butler Storage Trial,26.0,0.337116912599319,0.26373626373626374,0.2619047619047619
2214,"Other Composite Dataset work; Use cases, Requirements, and/or Implementation work TBD.",12.0,0.337116912599319,0.26373626373626374,0.2619047619047619
2215,Firefly viewer (and IRSAVIewer) shows an extra coverage tab when doing a catalog search,1.0,0.27809307604994327,0.10347985347985347,0.10256410256410256
2216,Attend ADASS/IVOA meeting,20.0,0.9897843359818388,0.7976190476190477,0.7994505494505495
2217,F16 Supertask Requirements and Design,32.0,0.4733257661748014,0.9459706959706959,0.34798534798534797
2218,Include processFile in lsst_ci,0.5,0.0,0.09615384615384616,0.09615384615384616
2219,Increase mask plane size to 32 bits,12.0,0.3348467650397276,0.9807692307692307,0.9807692307692307
2220,F16 QServ Improvements II,26.0,0.0,0.9459706959706959,0.34798534798534797
2221,"Attend LDM-151 meeting, 2016-08-31",1.0,0.06129398410896708,1.0,1.0
2222,"Attend LDM-151 meeting, 2016-08-31",1.0,0.8286038592508513,1.0,1.0
2223,"Attend LDM-151 Meeting, 2016-08-31",1.0,0.7582292849035187,1.0,1.0
2224,Firefly: filtering catalog data results in re-zoom and recalculation of coverage/context image,10.0,0.2849035187287174,0.10347985347985347,0.10256410256410256
2225,Review current sizing model inputs,5.0,0.03859250851305335,0.9459706959706959,0.34798534798534797
2226,Understand Production requirements to Supertask,4.0,0.4733257661748014,0.9459706959706959,0.34798534798534797
2227,CI Improvements: Jenkins updates,15.0,0.5550510783200908,0.4065934065934066,0.4065934065934066
2228,Load calexps into PDAC,8.0,0.2690124858115778,0.9459706959706959,0.34798534798534797
2229,"SQuare Requirement, Design, & Review Docs for DM - Part II",35.0,0.18047673098751418,0.3031135531135531,0.304029304029304
2230,PDAC imgserv Butler configuration,8.0,0.19182746878547105,0.9459706959706959,0.34798534798534797
2231,QA Section of LDM-151,30.0,0.18047673098751418,0.3031135531135531,0.304029304029304
2232,Ad-hoc Docs & Comms requests Part II,15.0,0.9125993189557321,0.6565934065934066,0.304029304029304
2233,Examine existing storage model,10.0,0.5743473325766175,0.9459706959706959,0.34798534798534797
2234,Begin ingest of S13 DRP data to PDAC,20.0,0.2690124858115778,0.9459706959706959,0.34798534798534797
2235,Merge in external updates to lsst-sqre/conda-lsst,0.5,0.13393870601589103,0.09706959706959707,0.09706959706959707
2236,Modify format of version numbers,1.0,0.09534619750283768,0.08241758241758242,0.08333333333333333
2237,Integrate sciSQL in eups,9.0,0.4177071509648127,0.3543956043956044,0.3543956043956044
2238,Pipelines Documentation Part 3,35.0,0.9125993189557321,0.6565934065934066,0.6538461538461539
2239,Switch to lsst.log in coadd_utils and coadd_chisquared,4.0,0.49375709421112374,0.43956043956043955,0.43864468864468864
2240,Discuss deblender requirements with stakeholders,2.0,0.07491486946651532,1.0,1.0
2241,Compile list of missing or inadequate deblender functionality,1.0,0.07491486946651532,1.0,1.0
2242,Design refactored deblender,6.0,0.07491486946651532,1.0,1.0
2243,Fix typo in DMTN-023 instruction for running multiBandDriver.py ,0.1,0.11577752553916004,0.08058608058608059,0.08058608058608059
2244,Eslint rules for JSDoc,6.0,0.10556186152099886,0.12545787545787546,0.12545787545787546
2245,Logging system sensitive to %s in string,2.0,1.0,0.8232600732600732,0.8232600732600732
2246,Replacing boost system lib with eups libs breaks scons build,3.0,0.4177071509648127,0.3543956043956044,0.3543956043956044
2247,Add support for HSC-R2 filter,0.5,0.16572077185017026,0.13278388278388278,0.13278388278388278
2248,Firefly API JSDoc build in Jekins,2.0,0.2383654937570942,0.12545787545787546,0.12545787545787546
2249,obs packages need a unified test framework,40.0,0.5675368898978433,0.5009157509157509,0.5009157509157509
2250,'title' and 'h1' tags in lse-163.lsst.io don't match,0.1,0.9125993189557321,0.26282051282051283,0.2591575091575092
2251,Rationalize test database URLs in test code,0.1,0.9897843359818388,0.7976190476190477,0.7994505494505495
2252,cat tests have incorrect assert sense and next() usage,0.1,0.9897843359818388,0.7976190476190477,0.7994505494505495
2253,Fix ordering when returning jobs from the api,1.0,0.7298524404086265,0.5576923076923077,0.5576923076923077
2254,Wrap log package with pybind11 instead of swig,2.0,0.2054483541430193,0.21428571428571427,0.21428571428571427
2255,Rebase pybind11 branch onto unit test and Python 3 changes,4.0,0.2054483541430193,0.21428571428571427,0.21428571428571427
2256,XY plot is not shown after closing one of the catalog tab,2.0,0.2383654937570942,0.10347985347985347,0.10256410256410256
2257,Add image feature in the image viewer toolbar is inconsistent when single image,1.0,0.27809307604994327,0.10347985347985347,0.10256410256410256
2258,obs_sdss test should not print outside of test,1.0,0.11577752553916004,0.7976190476190477,0.7994505494505495
2259,Reduce verbosity of star selector,0.1,0.16572077185017026,0.13278388278388278,0.13278388278388278
2260,Activate junk suppression by default,1.0,0.16572077185017026,0.13278388278388278,0.13278388278388278
2261,Python Coding Standard Copy Edits,0.5,0.9125993189557321,0.6565934065934066,0.6538461538461539
2262,Fix failure to fail,0.1,0.16572077185017026,0.13278388278388278,0.13278388278388278
2263,Update log documentations for marking RFC-203 implemented,9.0,0.49375709421112374,0.43956043956043955,0.43864468864468864
2264,Jenkins is no longer displaying test failure output,0.5,0.5550510783200908,0.7976190476190477,0.7994505494505495
2265,"Add ""disallow if False:"" note to developer docs",0.5,0.5675368898978433,0.5009157509157509,0.5009157509157509
2266,astrometry_net log is not controllable from the command line interface,1.0,0.49375709421112374,0.43956043956043955,0.43864468864468864
2267,Random failure of afw testBox.py,0.1,0.9897843359818388,0.7976190476190477,0.7994505494505495
2268,list the JS source files that need JSDoc generated for JS API,1.0,0.21112372304199772,0.4468864468864469,0.4441391941391941
2269,HSM isn't getting configured,1.0,0.7582292849035187,0.13278388278388278,0.13278388278388278
2270,CModel is producing SingularTransformException,1.0,0.16572077185017026,0.13278388278388278,0.13278388278388278
2271,"""Docstrings SHOULD NOT be preceded or followed by a blank line"" needs update",0.5,0.9125993189557321,0.8232600732600732,0.8232600732600732
2272,Update obs_decam for new CameraGeom,6.0,0.38819523269012485,0.44047619047619047,0.4413919413919414
2273,Renew TLS certificate for community.lsst.org (2016),0.5,0.9125993189557321,0.6565934065934066,0.6538461538461539
2274,Change background and text color in image toolbar and label (left),1.0,0.0340522133938706,0.10347985347985347,0.10256410256410256
2275,Document utility structures needed for Forward Global Calibration Module,4.0,0.2814982973893303,1.0,1.0
2276,create a shared stack in GPFS for Verification Cluster ,1.0,0.7582292849035187,0.09065934065934066,0.09065934065934066
2277,Remove the extra column on far right-hand side of a table when no description is available,2.0,0.2383654937570942,0.10347985347985347,0.10256410256410256
2278,constructBias.py crashes with errors about log,5.0,0.49375709421112374,0.43956043956043955,0.43864468864468864
2279,afw:testGaussianProcess has an intermittent test failure,3.0,0.014755959137343927,0.7976190476190477,0.7994505494505495
2280,lsst-technote-bootstrap routine update,0.7,0.9125993189557321,0.6565934065934066,0.6538461538461539
2281,Experiment with Piff,5.0,0.11577752553916004,1.0,1.0
2282,Add (t)csh and zsh alternatives to lsstsw bin/setup.sh,2.0,0.4699205448354143,0.08058608058608059,0.08058608058608059
2283,Merge XRootD plugin link changes from upstream and adapt Qserv,1.0,0.5743473325766175,0.9459706959706959,0.34798534798534797
2284,put JSDoc how-to in https://developer.lsst.io/,10.0,0.024971623155505107,0.4468864468864469,0.4441391941391941
2285,Ad-hoc developer requests Part II,8.0,0.5550510783200908,0.3031135531135531,0.304029304029304
2286,Remove lsst_ci from demo in Jenkins and add to default product list,1.5,0.5550510783200908,0.3031135531135531,0.304029304029304
2287,Create dependency map for Data Release Production,4.0,0.7582292849035187,1.0,1.0
2288,Create dependency map for Calibration Products Production,3.0,0.7582292849035187,1.0,1.0
2289,Investigate OmniPlan as a planning tool,2.0,0.7582292849035187,1.0,1.0
2290,Audit Calibration Products Pipeline section of LDM-151,5.0,0.7582292849035187,1.0,1.0
2291,Audit Data Release Production section of LDM-151,5.0,0.7582292849035187,1.0,1.0
2292,Take part in 2016-09-08 planning meeting,1.0,0.7582292849035187,1.0,1.0
2293,Produce straw-man plan for DRP,8.0,0.7582292849035187,1.0,1.0
2294,Add bbox to ExposureInfo,10.0,0.0,0.8232600732600732,0.8232600732600732
2295,Add missing pex_logging dependency in ups,1.0,0.49375709421112374,0.43956043956043955,0.43864468864468864
2296,Butler Repository fails to import mapper module,1.0,0.337116912599319,0.26373626373626374,0.2619047619047619
2297,C++ style guide links to an out-dated confluence page on devtools support,0.2,0.9125993189557321,0.6565934065934066,0.6538461538461539
2298,Add moving target WCS target match,8.0,0.27809307604994327,0.2490842490842491,0.2490842490842491
2299,Initial Draft of LDM-493: taxonomy of documentation,16.7,0.9125993189557321,0.6565934065934066,0.6538461538461539
2300,validate_base framework for metric measurements,15.0,0.9125993189557321,0.6565934065934066,0.6538461538461539
2301,Documentation Working Group,21.0,0.9125993189557321,0.6565934065934066,0.6538461538461539
2302,DocHub Planning,7.0,0.9125993189557321,0.6565934065934066,0.6538461538461539
2303,Set default detection threshold to 5.0-sigma if decorrelation is turned on,2.0,0.09194097616345062,0.0695970695970696,0.0695970695970696
2304,Redirect log of processccd.py in validate_drp script   ,1.0,0.49375709421112374,0.5576923076923077,0.5576923076923077
2305,Create obs_base and make obs_test work with it,8.0,0.5675368898978433,0.5009157509157509,0.5009157509157509
2306,Stretch: Data and test script specification for daily/automated QA/integration tests,70.0,0.026106696935300794,0.44047619047619047,0.4413919413919414
2307,Organize DM User Guide Tiger Teams,0.7,0.9125993189557321,0.6565934065934066,0.6538461538461539
2308,Use box annotations to indicate missing jobs,2.5,0.7298524404086265,0.5576923076923077,0.5576923076923077
2309,Ensure flux measurement is correct in decorrelated image differences,4.0,0.09194097616345062,0.0695970695970696,0.0695970695970696
2310,Fix missing code lines in doxygen page on using masked image locators,0.5,0.7582292849035187,0.020146520146520148,0.020146520146520148
2311,lsstsw deploy script uses unportable tty option,0.125,0.5550510783200908,0.7976190476190477,0.7994505494505495
2312,add lsst_py3 job to jenkins,0.5,0.5550510783200908,0.4065934065934066,0.4065934065934066
2313,Add timesys argument to DateTime constructor to toString (implement RFC-219),3.0,1.0,0.8232600732600732,0.8232600732600732
2314,Update MPICH,2.0,0.16572077185017026,0.2600732600732601,0.2600732600732601
2315,SUIT vision document,2.0,0.2849035187287174,0.4468864468864469,0.4441391941391941
2316,review and revise the SUIT requirement document,6.0,0.2849035187287174,0.4468864468864469,0.4441391941391941
2317,Putting the SUIT requirements in MagicDraw,6.0,0.2849035187287174,0.4468864468864469,0.4441391941391941
2318,Make use of the phase folded code,1.0,0.0340522133938706,0.10347985347985347,0.10256410256410256
2319,Extra phase column is displayed with too few precision,2.0,0.2383654937570942,0.10347985347985347,0.10256410256410256
2320,Understand preconvolution implementation in ip_diffim,6.0,0.09194097616345062,0.0695970695970696,0.0695970695970696
2321,Release Engineering and Automation,23.0,0.13393870601589103,0.09706959706959707,0.09706959706959707
2322,Chatops for Slack,7.5,0.18047673098751418,0.09706959706959707,0.09706959706959707
2323,Liveness and uptime monitoring,7.5,0.8649262202043133,0.09706959706959707,0.09706959706959707
2324,Identify Data Set for MiniProduction,3.0,0.38819523269012485,0.44047619047619047,0.4413919413919414
2325,Pytest and Flake8 integration with CI and sconsUtils,15.0,0.13393870601589103,0.09706959706959707,0.09706959706959707
2326,logging.lsst.codes improvements 2,15.0,0.8649262202043133,0.09706959706959707,0.09706959706959707
2327,file() in lsst.cat should be open(),1.0,0.4188422247446084,0.23443223443223443,0.21245421245421245
2328,SQuaSH ad-hoc usability improvements,52.0,0.11577752553916004,0.3031135531135531,0.304029304029304
2329,Generate data for MiniProduction,5.0,0.38819523269012485,0.44047619047619047,0.4413919413919414
2330,Implement Target Panel resolve option  (ned then simbad or simbad then ned),1.0,0.27809307604994327,0.2490842490842491,0.2490842490842491
2331,Implement spatially varying decorrelation kernel in ip_diffim,12.0,0.09194097616345062,0.0695970695970696,0.0695970695970696
2332,Separate the presentation layer from API access in the metrics app,2.0,0.7298524404086265,0.5576923076923077,0.5576923076923077
2333,Task Documentation,42.0,0.7582292849035187,1.0,1.0
2334,Update tests in shapelet to support pytest,1.0,0.9897843359818388,0.7976190476190477,0.7994505494505495
2335,Install GPFS on LSSTdev servers,5.0,0.3166855845629966,0.8745421245421245,0.9010989010989011
2336,Create scripts to run MiniProduction,3.0,0.18047673098751418,0.44047619047619047,0.4413919413919414
2337,Update the conda versions before next release,1.5,0.5550510783200908,0.7976190476190477,0.7994505494505495
2338,DateTime rejects an acceptable date,2.0,1.0,0.8232600732600732,0.8232600732600732
2339,Modernize tests in datarel to support pytest,0.1,0.9897843359818388,0.7976190476190477,0.7994505494505495
2340,Modernize dax_webservcommon tests to work with pytest,0.5,0.12145289443813848,0.7976190476190477,0.7994505494505495
2341,Modernize dax_dbserv tests to support pytest,1.0,0.12145289443813848,0.7976190476190477,0.7994505494505495
2342,Modernize dax_metaserv to support pytest,1.0,0.12145289443813848,0.7976190476190477,0.7994505494505495
2343,Eliminate local pixel indexing; always use parent instead,53.0,1.0,0.44047619047619047,0.4413919413919414
2344,"Dispaly ""null"" when a value ""null"" is in the data",2.0,0.2383654937570942,0.10347985347985347,0.10256410256410256
2345,"Replanning, ops planning, commissioning planning (F16)",100.0,0.15891032917139614,0.8745421245421245,0.9010989010989011
2346,Develop planning packages from DM replanning deliverables,76.0,0.1112372304199773,0.8745421245421245,0.9010989010989011
2347,Prepare acquisition strategy for FY17,15.0,0.2122587968217934,0.8745421245421245,0.9010989010989011
2348,Develop the Service Catalog,25.0,0.07377979568671963,0.8745421245421245,0.9010989010989011
2349,L1 System: Targeted support for integration effort,92.0,0.19977298524404086,0.8745421245421245,0.9010989010989011
2350,L1 System: Phase 1 expansion and emergent work,65.0,0.19977298524404086,0.8745421245421245,0.9010989010989011
2351,L1 System Mock 3: footprint of L1 I/O through Butler,44.0,0.4108967082860386,0.8745421245421245,0.9010989010989011
2352,"Prototype pipelines, workflow, and task sequences in the production environment towards development of the Batch Processing Service",45.0,0.49375709421112374,0.8745421245421245,0.9010989010989011
2353,Python 3 migration work (cont'd) and pytest work,17.0,0.4188422247446084,0.8745421245421245,0.9010989010989011
2354,Exception naming convention,5.0,1.0,0.44047619047619047,0.4413919413919414
2355,"Emergent middleware work (F16, part 2)",30.0,0.04199772985244041,0.8745421245421245,0.9010989010989011
2356,Prototype functionalities of scaled batch production service components,47.0,0.4188422247446084,0.8745421245421245,0.9010989010989011
2357,Investigate the use of resource management in the production environment towards development of the ITC provisioning framework,11.0,0.2122587968217934,0.8745421245421245,0.9010989010989011
