956,Update developer guide with pytest guidance,5.0,0.9897843359818388,0.7976190476190477,0.7994505494505495
957,Change SubtractBackgroundConfig.isNanSafe default to True,1.0,0.0,0.8232600732600732,0.8232600732600732
958,Create and deploy Beats for Logstash and Elasticsearch.,3.0,0.13393870601589103,0.09706959706959707,0.09706959706959707
959,Miscellaneous Nebula service items for x16,8.0,0.17480136208853575,0.09065934065934066,0.09065934065934066
960, tests in testArgumentParser.py fail Jenkins run-rebuild on nfs,2.0,0.49375709421112374,0.43956043956043955,0.43864468864468864
961,update jenkins to 2.x,10.0,0.5550510783200908,0.4065934065934066,0.4065934065934066
962,Stop cleanly MySQL if configuration step fails,2.0,0.0,0.3543956043956044,0.3543956043956044
963,Use RO MySQL account in qserv_testdata,4.0,0.5743473325766175,0.3543956043956044,0.3543956043956044
964,Add unicode support for Qserv password,6.0,0.0,0.3543956043956044,0.3543956043956044
965,Use sagas in place of side-effects in chart-related controllers ,3.0,0.21112372304199772,0.12545787545787546,0.12545787545787546
966,Support Monocam reduction,6.0,0.16572077185017026,0.13278388278388278,0.13278388278388278
967,Generate PS1 3pi PV3 reference catalogs,10.0,0.16572077185017026,0.13278388278388278,0.13278388278388278
968,Investigate off-the-shelf data distribution tools,12.0,0.03859250851305335,0.9459706959706959,0.5815018315018315
969,A look at the overall performance of the application,4.0,0.2383654937570942,0.07692307692307693,0.07875457875457875
970,Reception and Placement,10.0,0.2122587968217934,0.13003663003663005,0.13003663003663005
971,Networking Configuration,15.0,0.2122587968217934,0.13003663003663005,0.13003663003663005
972,Provisioning,39.0,0.2122587968217934,0.13003663003663005,0.13003663003663005
973,Disaster Recovery Implementation,30.0,0.2122587968217934,0.13003663003663005,0.13003663003663005
974,Documentation,5.0,0.2122587968217934,0.13003663003663005,0.13003663003663005
975,Capability Validation,10.0,0.2122587968217934,0.13003663003663005,0.13003663003663005
976,Security Vetting,3.0,0.2122587968217934,0.13003663003663005,0.13003663003663005
977,Acceptance by Stakeholders,2.0,0.2122587968217934,0.13003663003663005,0.13003663003663005
978,fix 12 issues in testCppParser (related to switching to CSS),3.0,0.5743473325766175,0.9459706959706959,0.5815018315018315
979,Acceptance by Stakeholders,5.0,0.2122587968217934,0.13003663003663005,0.13003663003663005
980,Procurement,8.0,0.2122587968217934,0.13003663003663005,0.13003663003663005
981,Reception and Placement,3.0,0.2122587968217934,0.13003663003663005,0.13003663003663005
982,Networking Configuration,10.0,0.2122587968217934,0.13003663003663005,0.13003663003663005
983,Provisioning,30.0,0.2122587968217934,0.13003663003663005,0.13003663003663005
984,Disaster Recovery Implementation,20.0,0.2122587968217934,0.13003663003663005,0.13003663003663005
985,Documentation,15.0,0.17480136208853575,0.13003663003663005,0.13003663003663005
986,Capability Validation	,15.0,0.2122587968217934,0.13003663003663005,0.13003663003663005
987,Security Vetting,10.0,0.2122587968217934,0.13003663003663005,0.13003663003663005
988,Acceptance by Stakeholders,20.0,0.2122587968217934,0.13003663003663005,0.13003663003663005
989,Reception and Placement,2.0,0.2122587968217934,0.13003663003663005,0.13003663003663005
990,Networking Configuration,3.0,0.2122587968217934,0.13003663003663005,0.13003663003663005
991,Provisioning,10.0,0.2122587968217934,0.13003663003663005,0.13003663003663005
992,Disaster Recovery Implementation,4.0,0.2122587968217934,0.13003663003663005,0.13003663003663005
993,Documentation,4.0,0.2122587968217934,0.13003663003663005,0.13003663003663005
994,Capability Validation,5.0,0.2122587968217934,0.13003663003663005,0.13003663003663005
995,Add support for installing qserv on machines without internet,9.0,0.4177071509648127,0.9459706959706959,0.5815018315018315
996,Security Vetting,6.0,0.2122587968217934,0.13003663003663005,0.13003663003663005
997,Acceptance by Stakeholders,6.0,0.2122587968217934,0.13003663003663005,0.13003663003663005
998,Lazy load related chart data on table data update,3.0,0.21112372304199772,0.12545787545787546,0.12545787545787546
999,ingest.py throwing away errors,1.0,0.0,0.2902930402930403,0.2902930402930403
1000,Make it possible to distinguish TABLE_NEW_LOADED actions triggered by sort,2.0,0.2383654937570942,0.12545787545787546,0.12545787545787546
1001,Validation is not performed on unchanged fields,2.0,0.27809307604994327,0.12545787545787546,0.12545787545787546
1002,Error message is not shown,1.0,0.27809307604994327,0.12545787545787546,0.12545787545787546
1003,Look into git-fat,4.0,0.38819523269012485,0.44047619047619047,0.4413919413919414
1004,Investigate possibilty of cosmic ray muons (etc) for precision gain calibration,8.0,0.34506242905788875,0.2902930402930403,0.2902930402930403
1005,Create documentation for bright object masks,3.0,0.0,0.20238095238095238,0.20238095238095238
1006,Support sphinxcontrib-bibtex in technotes,3.6,0.9125993189557321,0.6565934065934066,0.6538461538461539
1007,Produce and ingest master calibs for USNO monocam data.,2.0,0.34506242905788875,0.2902930402930403,0.2902930402930403
1008,Reduce sky data from USNO monocam run,3.0,0.34506242905788875,0.2902930402930403,0.2902930402930403
1009,Monocam bias structure analysis,1.0,0.34506242905788875,0.2902930402930403,0.2902930402930403
1010,Download temporally relevant raw calibs for CTIO DECam data,1.0,0.34506242905788875,0.2902930402930403,0.2902930402930403
1011,Update parse/analysis tests to detect missing css-kvmap early,4.0,0.5743473325766175,0.9459706959706959,0.024725274725274724
1012,Create and ingest master calibs for DECam CBP reduction,2.0,0.34506242905788875,0.2902930402930403,0.2902930402930403
1013,Functional use cases for light curve ,1.0,0.094211123723042,0.0695970695970696,0.06868131868131869
1014,Add viewer launching API,6.0,0.27809307604994327,0.2490842490842491,0.2490842490842491
1015,Change mouse readout to use supports MouseReadoutCntlr & add an API readout,10.0,0.10556186152099886,0.2490842490842491,0.2490842490842491
1016,Nominal PSF required by processCcd,2.0,0.11577752553916004,0.2902930402930403,0.2902930402930403
1017,Bundle up more HSC data for validate_drp,3.0,0.16572077185017026,0.13278388278388278,0.13278388278388278
1018,Table caching optimizations,2.0,0.21112372304199772,0.12545787545787546,0.12545787545787546
1019,Add extendedness vs. star selector test to single-visit validation in ci_hsc,2.0,0.04767309875141884,0.9807692307692307,0.9807692307692307
1020,Improve password management for Qserv MySQL accounts,8.0,0.0,0.3543956043956044,0.3543956043956044
1021,Allow use of other MySQL account thant 'qsmaster',4.0,0.0,0.3543956043956044,0.3543956043956044
1022,Minor updates in suptertask from following DMTN-002,2.0,0.49375709421112374,0.43956043956043955,0.43864468864468864
1023,Remove PTR and CONST_PTR macros,6.0,0.06923950056753689,0.21428571428571427,0.21428571428571427
1024,v12.0 [Winter 2016 / Extra 2016] release,12.0,0.18047673098751418,0.3031135531135531,0.304029304029304
1025,Support intersphinx in LSST Docs,0.2,0.9125993189557321,0.6565934065934066,0.6538461538461539
1026,proper motions handling in jointcal,8.0,0.5675368898978433,0.0,0.0
1027,Launch integration tests using Docker+Openstack,10.0,0.5743473325766175,0.3543956043956044,0.3543956043956044
1028,Fix how aperture correction is applied,1.0,0.29284903518728717,0.8232600732600732,0.8232600732600732
1029,"Define, design, and RFC repository refactor.",18.0,0.337116912599319,0.26373626373626374,0.2619047619047619
1030,design work for butler storage & format factorization,5.0,0.337116912599319,0.26373626373626374,0.2619047619047619
1031,F17 Butler S3 Storage,45.0,0.337116912599319,0.26373626373626374,0.2619047619047619
1032,S17 Butler DB storage,40.0,0.337116912599319,0.26373626373626374,0.2619047619047619
1033,Camera team visualization support (F16),12.0,0.24971623155505107,0.4468864468864469,0.4441391941391941
1034,CSS throws exception if tableIsSubChunked is called for non partitioned table,3.0,0.5743473325766175,0.9459706959706959,0.5815018315018315
1035,L1 Messaging path status,40.0,0.19977298524404086,0.14652014652014653,0.14652014652014653
1036,Li prototype code and the Wan Emulator,10.0,0.19977298524404086,0.14652014652014653,0.14652014652014653
1037,Pass background to NoiseReplacerTask,4.0,0.0,0.8232600732600732,0.8232600732600732
1038,Add RegistryField support to Task.makeSubtask,2.0,1.0,0.8232600732600732,0.8232600732600732
1039,Document the need for abstract base tasks for tasks,2.0,0.08626560726447219,0.8232600732600732,0.8232600732600732
1040,Create a registry for star selectors,3.0,0.0,0.8232600732600732,0.8232600732600732
1041,Change PSF determiners into tasks,1.0,1.0,0.8232600732600732,0.8232600732600732
1042,Aperture correction fails to measure a correction for the final plugin in the list and reports misleading errors,2.0,0.8286038592508513,0.2078754578754579,0.2078754578754579
1043,description of archive in a box,1.0,0.2849035187287174,0.4468864468864469,0.4441391941391941
1044,referring to table without database context crashes czar,3.0,0.5743473325766175,0.9459706959706959,0.5815018315018315
1045,Add Sublime Text configuration tips to Developer Documentation,1.0,0.0,0.09615384615384616,0.09615384615384616
1046,Enable websocket client to pickup channel parameter from url,1.0,0.2383654937570942,0.07692307692307693,0.07875457875457875
1047,JSON Schema for metric data from validate_drp to be ingested by the QA Dashboard app,7.5,0.9125993189557321,0.6565934065934066,0.6538461538461539
1048,jenkins job to execute validate_drp and push results to qa dashboard,6.5,0.5550510783200908,0.4065934065934066,0.4065934065934066
1049,Use fixed width integer types from std instead of boost,1.0,0.2054483541430193,0.21428571428571427,0.21428571428571427
1050,afw unit tests not built unless afwdata available,1.0,0.04767309875141884,0.8232600732600732,0.8232600732600732
1051,draw a diagram of DRP data flow,4.0,0.49375709421112374,0.43956043956043955,0.43864468864468864
1052,Improve afw.table Astropy view support,4.0,0.0,0.9807692307692307,0.9807692307692307
1053,afw/tests/rgb.py fails due to .ttf files,0.5,0.5675368898978433,0.5009157509157509,0.5009157509157509
1054,implement basic oauth2 authentication for qa-dashboard,6.0,0.5550510783200908,0.4065934065934066,0.4065934065934066
1055,Implement the post_save mechanism to update bokeh sessions when new data is available,4.0,0.7298524404086265,0.5576923076923077,0.5576923076923077
1056,color map in visualization,4.0,0.24971623155505107,0.4468864468864469,0.4441391941391941
1057,Firefly performance profiling and code refactoring if needed,22.0,0.24971623155505107,0.4468864468864469,0.4441391941391941
1058,More work on firefly viewer layout control,8.0,0.2383654937570942,0.2490842490842491,0.2490842490842491
1059,Switch kazoo version to 2.0b1 or later,2.0,0.4177071509648127,0.9459706959706959,0.024725274725274724
1060,Browsers should cache editions for a shorter time period than Fastly,1.0,0.9125993189557321,0.6565934065934066,0.6538461538461539
1061,Provide minimal documentation for meas_extensions_photometryKron,0.5,0.7582292849035187,1.0,1.0
1062,Calibration Products Pipeline work during F16,65.0,0.34506242905788875,1.0,1.0
1063,Remove duplicate lines,0.1,0.16572077185017026,0.13278388278388278,0.13278388278388278
1064,The color stretch dialog box does not work properly,5.0,0.10556186152099886,0.047619047619047616,0.04945054945054945
1065,"update ""newinstall.sh"" nebula images & docker containers - w_2016_20",0.5,0.5550510783200908,0.4065934065934066,0.4065934065934066
1066,remove obsolete QMS-related code,2.0,0.4177071509648127,0.9459706959706959,0.5815018315018315
1067,Add LSST branding and edit on GitHub button to Developer Guide,1.6,0.9125993189557321,0.3031135531135531,0.304029304029304
1068,Remove old DipoleMeasurementAlgorithm from imageDifference.py,4.0,0.0,0.0695970695970696,0.0695970695970696
1069,Build SFM housing for PSF approximation using ngmix code,6.0,0.14982973893303064,0.054945054945054944,0.054945054945054944
1070,Testing ngmix Psf plugin with CModel,6.0,0.14982973893303064,0.054945054945054944,0.054945054945054944
1071,Do robustness tests of ngmix PSF approx plugin,6.0,0.14982973893303064,0.054945054945054944,0.054945054945054944
1072,LSST's version of Astrometry.net doesn't build on Ubuntu 16.04,1.0,0.13393870601589103,0.09706959706959707,0.09706959706959707
1073,ngmix has no license,1.0,0.8286038592508513,1.0,1.0
1074,Expanded view not doing fit/fill consistently ,1.0,0.27809307604994327,0.2490842490842491,0.2490842490842491
1075,Automated test differences after CSS migration,6.0,0.4733257661748014,0.23809523809523808,0.23626373626373626
1076,Fix docker git script: providing both -R and QSERV_DIR make it fails,2.0,0.4177071509648127,0.3543956043956044,0.3543956043956044
1077,Add kwarg forwarding to AstroPy table views,0.1,0.8286038592508513,0.9807692307692307,0.9807692307692307
1078,mpi4py does not compile under Yosemite due to hardcoded MACOSX_DEPLOYMENT_TARGET,1.0,0.7582292849035187,0.09615384615384616,0.09615384615384616
1079,Fix style of catalog panel ,4.0,0.0340522133938706,0.10347985347985347,0.10256410256410256
1080,Migrate VO search panel,16.0,0.0340522133938706,0.10347985347985347,0.10256410256410256
1081,Review and connect validation part to the input area field component,6.0,0.0340522133938706,0.10347985347985347,0.10256410256410256
1082,Add input based on catalog DD table,12.0,0.0340522133938706,0.10347985347985347,0.10256410256410256
1083,Change Fields groups to handle other actions better,2.0,0.27809307604994327,0.2490842490842491,0.2490842490842491
1084,Change server side hardcopy code to work better with the non-GWT call,2.0,0.27809307604994327,0.2490842490842491,0.2490842490842491
1085,rename qserv_admin.py to qserv-admin.py,1.0,0.5743473325766175,0.9459706959706959,0.5815018315018315
1086,Produce tech note describing detailed project management procedures,8.0,0.7582292849035187,1.0,1.0
1087,Drawing layer improvement to handle mouse selection,4.0,0.27809307604994327,0.2490842490842491,0.2490842490842491
1088,Client side Hardcopy support for png with drawing layer overlay,6.0,0.15664018161180476,0.2490842490842491,0.2490842490842491
1089,jenkins/qa terraform destroy fails if there is an existing rds final snapshot,1.5,0.5550510783200908,0.4065934065934066,0.4065934065934066
1090,Evaluate performance of dipole fitting in crowded regions,8.0,0.09194097616345062,0.0695970695970696,0.0695970695970696
1091,Set SUSPECT mask in ISR task and make saturation a double,5.0,1.0,0.8232600732600732,0.8232600732600732
1092,Publish LDM-151 PDF on LSST the docs,0.3,0.9125993189557321,0.6565934065934066,0.6538461538461539
1093,Reduce memory utilization in mysql proxy,2.0,0.4733257661748014,0.23809523809523808,0.23626373626373626
1094,lsstsw cannot deploy numdiff,0.125,0.5550510783200908,0.019230769230769232,0.019230769230769232
1095,Failure to fail when fallbackFilterName is None,1.0,0.16572077185017026,0.13278388278388278,0.13278388278388278
1096,long term re-plan,30.0,0.24971623155505107,0.4468864468864469,0.4441391941391941
1097,Variable bin size calculation in histogram ,10.0,0.0,0.4468864468864469,0.4441391941391941
1098,Attend SciPi WG meeting,8.0,0.38819523269012485,0.44047619047619047,0.4413919413919414
1099,Attend SciPi WG phonecon,3.0,0.38819523269012485,0.44047619047619047,0.4413919413919414
1100,Flesh out MOPS work,3.0,0.38819523269012485,0.44047619047619047,0.4413919413919414
1101,Attend SciPi WG F2F in Tucson,3.0,0.38819523269012485,0.44047619047619047,0.4413919413919414
1102,Flesh out the Level 1 processing diagram,10.0,0.38819523269012485,0.44047619047619047,0.4413919413919414
1103,commons.config should always be managed as a global variable,2.0,0.4177071509648127,0.3543956043956044,0.3543956043956044
1104,Adding an int to the end of CzarConfig causes a segfault error.,6.0,0.19182746878547105,0.09432234432234432,0.09432234432234432
1105,Investigate how the diffim decorrelation correction works for the case of non-uniform PSFs and noise,8.0,0.09194097616345062,0.0695970695970696,0.0695970695970696
1106,Implement the API replacing XYTransform,30.0,1.0,0.5009157509157509,0.5009157509157509
1107,Extend the capabilities of the StarFast simulator beyond the minimum needed for DCR algorithm testing,14.0,0.40408626560726446,0.4706959706959707,0.4697802197802198
1108,Time AST and compare to our WCS code,3.0,1.0,0.8232600732600732,0.8232600732600732
1109,Create DMBP project in jira,2.0,0.18047673098751418,0.010073260073260074,0.5815018315018315
1110,Wrap afw using pybind11,80.0,0.2054483541430193,1.0,1.0
1111,Participate in DM replanning process,140.0,0.7582292849035187,1.0,1.0
1112,PSF fitting study,15.0,0.7582292849035187,1.0,1.0
1113,Service technical debt accumulated in earlier cycles,100.0,0.7582292849035187,1.0,1.0
1114,F16 DRP emergent work,55.0,0.7582292849035187,1.0,1.0
1115,Serve as chair of the IVOA Time Domain Interest Group,20.0,0.7582292849035187,1.0,1.0
1116,Prepare for and participate in SBAG meeting,20.0,0.3348467650397276,1.0,1.0
1117,Visualization tools for Science Pipelines,20.0,0.3348467650397276,1.0,1.0
1118,Research coaddition,100.0,0.04767309875141884,1.0,1.0
1119,Increase memory locked amount in container,2.0,0.4177071509648127,0.3543956043956044,0.3543956043956044
1120,Add eups version for Qserv for stack packaged version,2.0,0.4177071509648127,0.3543956043956044,0.3543956043956044
1121,Support Python 3 migration,40.0,0.9897843359818388,0.7976190476190477,0.7994505494505495
1122,Update LSE-61 requirements and traceability,40.0,0.9897843359818388,0.7976190476190477,0.7994505494505495
1123,reST roles for JIRA References,1.5,0.9125993189557321,0.6565934065934066,0.6538461538461539
1124,Add dax_imgServe support for stripe82 ,8.0,0.19182746878547105,0.09432234432234432,0.09432234432234432
1125,sourceSelector needs a schema in ImageDifferenceTask,0.5,0.40408626560726446,0.4706959706959707,0.4697802197802198
1126,Add a python 3 Jenkins instance,12.0,0.5550510783200908,0.7976190476190477,0.7994505494505495
1127,Get jointcal running on minimum data,100.0,0.5675368898978433,0.44047619047619047,0.4413919413919414
1128,Provide input for the update of LDM-151,38.0,0.38819523269012485,0.44047619047619047,0.4413919413919414
1129,"First draft of overview (""vision"") document",3.0,0.18047673098751418,0.3031135531135531,0.304029304029304
1130,Complete update to LDM-230,10.0,0.08626560726447219,0.1510989010989011,0.1510989010989011
1131,Update sizing/cost model,10.0,0.08626560726447219,0.1510989010989011,0.1510989010989011
1132,Refine SuperTask design document,13.0,0.2849035187287174,0.1510989010989011,0.1510989010989011
1133,Update LSE-75 DM-TCS ICD,5.0,0.08626560726447219,0.1510989010989011,0.1510989010989011
1134,Update LSE-72 DM-OCS ICD,5.0,0.08626560726447219,0.1510989010989011,0.1510989010989011
1135,Update LSE-68 DM-Camera DAQ ICD,5.0,0.08626560726447219,0.1510989010989011,0.1510989010989011
1136,Provide input to Commissioning Plan,5.0,0.08626560726447219,0.1510989010989011,0.1510989010989011
1137,SQuaSH capability extension: multiple testdata service,92.0,0.7298524404086265,0.3031135531135531,0.304029304029304
1138,Update LSE-76 Summit ICD,2.0,0.2849035187287174,0.1510989010989011,0.1510989010989011
1139,Ad-hoc Docs & Comms requests,12.0,0.9125993189557321,0.6565934065934066,0.304029304029304
1140,Stack API documentation ,20.0,0.9125993189557321,0.3031135531135531,0.304029304029304
1141,Resource load F16 part II,6.0,0.18047673098751418,0.3031135531135531,0.304029304029304
1142,"SQuare Requirement, Design, & Review Docs for DM",35.0,0.11577752553916004,0.3031135531135531,0.304029304029304
1143,Releases and Release Engineering Improvements,16.0,0.18047673098751418,0.3031135531135531,0.304029304029304
1144,Build/CI/Deploy improvements requested by the DAX/Qserv team,24.0,0.5550510783200908,0.3031135531135531,0.304029304029304
1145,Build/CI/Deploy improvements requested by the Architecture Team,4.0,0.5550510783200908,0.3031135531135531,0.304029304029304
1146,CI Improvements: Jenkins 2 upgrade etc,8.0,0.5550510783200908,0.3031135531135531,0.304029304029304
1147,CI/Build/Deploy improvements for Sims,4.0,0.5550510783200908,0.3031135531135531,0.304029304029304
1148,SQuaRE services disaster recovery,8.0,0.8649262202043133,0.3031135531135531,0.304029304029304
1149,Ad-hoc developer requests,8.0,0.5550510783200908,0.3031135531135531,0.304029304029304
1150,User friendly single node loading script,8.0,0.4733257661748014,0.027472527472527472,0.027472527472527472
1151,Improve OSX support,16.0,0.13393870601589103,0.3031135531135531,0.304029304029304
1152,Gitlfs maintenance - protocol upgrade etc,8.0,0.13393870601589103,0.3031135531135531,0.304029304029304
1153,Slack migration,8.0,0.13393870601589103,0.3031135531135531,0.304029304029304
1154,Conda binary distribution improvements,16.0,0.13393870601589103,0.3031135531135531,0.304029304029304
1155,logging.lsst.codes improvements,8.0,0.13393870601589103,0.3031135531135531,0.304029304029304
1156,Verification dataset exploratory work,16.0,0.7298524404086265,0.3031135531135531,0.304029304029304
1157,F16 DAX Services Containers & Ops,10.0,0.12145289443813848,0.9459706959706959,0.34798534798534797
1158,F16 DAX Services Improvements,10.0,0.0,0.9459706959706959,0.34798534798534797
1159,F16 NCSA Dax Services Deploy,10.0,0.12145289443813848,0.9459706959706959,0.34798534798534797
1160,F16 Replan,33.0,0.5743473325766175,0.9459706959706959,0.34798534798534797
1161,Qserv configuration tool refactoring,9.5,0.4177071509648127,0.9459706959706959,0.5815018315018315
1162,F16 Support SUIT for Prototype DAC,40.0,0.0,0.9459706959706959,0.34798534798534797
1163,F16 L1 DB Prototype I,89.0,0.4733257661748014,0.9459706959706959,0.34798534798534797
1164,F16 NCSA Stripe 82 Image Ingest,36.0,0.0,0.9459706959706959,0.34798534798534797
1165,F16 Butler Repository Refactor,40.0,0.337116912599319,0.9459706959706959,0.34798534798534797
1166,F16 Butler Storage & Format Refactor,35.0,0.337116912599319,0.9459706959706959,0.34798534798534797
1167,F16 Butler Composite Dataset Design,50.0,0.337116912599319,0.9459706959706959,0.34798534798534797
1168,[BG2] Butler Repo of Repos Design,20.0,0.0,0.9459706959706959,0.34798534798534797
1169,F16 VO Standards Investigation,10.0,0.0,0.9459706959706959,0.34798534798534797
1170,Package antlr 2.7 in eups,5.0,0.4177071509648127,0.3543956043956044,0.3543956043956044
1171,F16 Qserv Loader Improvements,103.0,0.2690124858115778,0.9459706959706959,0.34798534798534797
1172,F16 Qserv Containers and Ops,16.0,0.4177071509648127,0.9459706959706959,0.34798534798534797
1173,F16 QServ Improvements,82.0,0.5743473325766175,0.9459706959706959,0.34798534798534797
1174,F16 NCSA Qserv Deploy,34.0,0.0,0.9459706959706959,0.34798534798534797
1175,F16 NCSA Stripe 82 Catalog Ingest,20.0,0.0,0.9459706959706959,0.34798534798534797
1176,"Take part in LDM-151 Progress Meeting, 2016-05-27",1.0,0.7582292849035187,1.0,1.0
1177,"Take part in LDM-151 Progress Meeting, 2016-05-27",1.0,0.34506242905788875,1.0,1.0
1178,"Take part in LDM-151 Progress Meeting, 2016-05-27",1.0,0.8286038592508513,1.0,1.0
1179,Familiarization with RHL calibration documentation,4.0,0.34506242905788875,1.0,1.0
1180,The grid labels are not placed in the right position when the coordinate is Ecliptic coordianates,2.0,0.10556186152099886,0.047619047619047616,0.04945054945054945
1181,Make sure we have queryId in all places where needed in logging,4.0,0.0,0.9459706959706959,0.5815018315018315
1182,Support API interaction with Regions,10.0,0.15664018161180476,0.2490842490842491,0.2490842490842491
1183,Implement the ZOGY extension to the A&L algorithm in the stack,30.0,0.09194097616345062,0.44047619047619047,0.4413919413919414
1184,Study spatial variability of ZOGY correction,38.0,0.09194097616345062,0.44047619047619047,0.4413919413919414
1185,Study the impact of having a spatially invariant decorrelation correction factor to A&L,8.0,0.09194097616345062,0.44047619047619047,0.4413919413919414
1186,Assess performance of the decorrelation correction to A&L,6.0,0.09194097616345062,0.44047619047619047,0.4413919413919414
1187,Compare competing algorithms for correcting DCR in template images,49.0,0.40408626560726446,0.44047619047619047,0.4413919413919414
1188,Vertical overscan off by one again,0.5,1.0,0.8232600732600732,0.8232600732600732
1189,DRP Outline for LDM-151,2.0,0.8286038592508513,0.9807692307692307,0.9807692307692307
1190,"DRP Top-Level Diagram and Descriptions, Draft 1",2.0,0.8286038592508513,0.9807692307692307,0.9807692307692307
1191,Implement competing DCR algorithm,12.0,0.40408626560726446,0.44047619047619047,0.4413919413919414
1192,Too many connections from czar to zookeeper,1.0,0.5743473325766175,0.23809523809523808,0.23626373626373626
1193,Extend competing algorithm to arbitrary rotation angles.,6.0,0.40408626560726446,0.44047619047619047,0.4413919413919414
1194,Convert DRP Top-Level Diagram to standard conventions,2.0,0.021566401816118047,0.9807692307692307,0.9807692307692307
1195,Do bakeoff between the two algorithms in simplified case,6.0,0.40408626560726446,0.44047619047619047,0.4413919413919414
1196,Bakeoff between algorithms extended to arbitrary rotation.,6.0,0.40408626560726446,0.44047619047619047,0.4413919413919414
1197,Develop standard conventions and colors for LDM-151 diagrams,4.0,0.021566401816118047,0.9807692307692307,0.9807692307692307
1198,Improve detail for for DRP imchar/jointcal in LDM-151,6.0,0.8286038592508513,0.9807692307692307,0.9807692307692307
