3268,Policy::names(bool) ignores its argument,1.0,0.4699205448354143,0.4358974358974359,0.4358974358974359
3269,meas_astrom tests depend on PyQt4 and Qt4 and break with PyQt5 and Qt5,1.0,1.0,0.09706959706959707,0.09706959706959707
3270,JIRA / Slack integration,0.25,0.18047673098751418,0.3031135531135531,0.304029304029304
3271,Create a Unit Test for Geom class,8.0,0.10556186152099886,0.047619047619047616,0.04945054945054945
3272,Create a Unit Test for ImageData class,8.0,0.10556186152099886,0.047619047619047616,0.04945054945054945
3273,Incorrect PYTHONPATH in firefly_client repo,0.5,0.094211123723042,0.0695970695970696,0.06868131868131869
3274,rework jointcalStatistics to use better n-way matcher and RMS data structures,15.0,0.0,0.5009157509157509,0.5009157509157509
3275,Extract query columns,6.0,0.12145289443813848,0.9459706959706959,0.34798534798534797
3276,jenkins dev 'quick start' docs,0.5,0.5550510783200908,0.4065934065934066,0.4065934065934066
3277,Changes to lsstsw to add ctrl_platform_lsstvc remove old ctrl_platform_* references,2.0,0.4188422247446084,0.23443223443223443,0.21245421245421245
3278,Implement Period Finder Panel and do LcManager changes for LC UI,16.0,0.15664018161180476,0.2490842490842491,0.2490842490842491
3279,LCManager design,4.0,0.2383654937570942,0.2490842490842491,0.2490842490842491
3280,Revamp LC results area,14.0,0.15664018161180476,0.2490842490842491,0.2490842490842491
3281,Wrap testSourceTable with pybind11,6.0,1.0,0.21428571428571427,0.21428571428571427
3282,Rebase pybind11 branch on master and strip GPU code,1.0,0.2054483541430193,0.21428571428571427,0.21428571428571427
3283,Hide matplotlib imports in meas_algorithms,1.0,0.5675368898978433,0.5009157509157509,0.5009157509157509
3284,update jenkins qserv container generation job,1.0,0.5550510783200908,0.4065934065934066,0.4065934065934066
3285,update jenkins to 2.19.4,0.33299999999999996,0.5550510783200908,0.4065934065934066,0.4065934065934066
3286,Enable use of alternate registry while creating image,1.0,0.4177071509648127,0.3543956043956044,0.3543956043956044
3287,Implement RFC-263:  Add DECam COSMOS data to /datasets/decam/,3.0,0.49375709421112374,0.43956043956043955,0.43864468864468864
3288,implement Repository Relationships in Butler,10.0,0.337116912599319,0.26373626373626374,0.2619047619047619
3289,Revamp image expanded view so the it is more context specific,6.0,0.27809307604994327,0.2490842490842491,0.2490842490842491
3290,Options to plot asymmetric errors,10.0,0.21112372304199772,0.12545787545787546,0.12545787545787546
3291,Change Child Repo Access to Parent Registries,8.0,0.337116912599319,0.26373626373626374,0.2619047619047619
3292,implement Old Butler _parent discovery including outputRoot,10.0,0.337116912599319,0.26373626373626374,0.2619047619047619
3293,"testPsfSelectTest fails when run with via ""pytest *.py""",1.0,1.0,0.5009157509157509,0.5009157509157509
3294,disable extraneous warnings from boost (gcc 4.8),0.5,0.8286038592508513,0.9459706959706959,0.5815018315018315
3295,ConvolvedFluxPlugin should measure even if seeing is small,1.0,0.16572077185017026,0.13278388278388278,0.13278388278388278
3296,ConvolvedFluxPlugin errors are underestimated,6.0,0.11691259931895573,0.13278388278388278,0.13278388278388278
3297,Wrap SpanSets class with pybind11,6.0,0.3348467650397276,0.20238095238095238,0.20238095238095238
3298,Refactor Deblender API,3.0,0.3337116912599319,0.2600732600732601,0.2600732600732601
3299,Fix dataRef list creation bug introduced in DM-8230,1.0,0.29284903518728717,0.2078754578754579,0.2078754578754579
3300,Wrap testTicketDM-433 with pybind11,1.0,0.2054483541430193,0.21428571428571427,0.21428571428571427
3301,Jenkins build failure in meas_modelfit,1.0,0.7582292849035187,1.0,1.0
3302,Add pybind11 interface for Point2DList and relatives,8.0,0.4699205448354143,0.4358974358974359,0.4358974358974359
3303,XLDB Rio - workshop report,3.0,0.5743473325766175,0.9459706959706959,0.5815018315018315
3304,Create api.lsst.codes and metadata definitions,3.5,0.8649262202043133,0.6071428571428571,0.608058608058608
3305,Copy and ingest HSC Cosmos data,1.0,0.49375709421112374,0.13278388278388278,0.13278388278388278
3306,Improve and fix bugs of Firefly Python API,30.0,0.24971623155505107,0.4468864468864469,0.4441391941391941
3307,Decouple makeCoaddTempExpTask.createTempExp() from Butler,4.0,0.0,0.43315018315018317,0.43315018315018317
3308,New Firefly visualization features in S18 ,100.0,0.24971623155505107,0.4468864468864469,0.4441391941391941
3309,catalog search mistakingly brings up an image tab,4.0,0.2383654937570942,0.4468864468864469,0.4441391941391941
3310,Options for plotting scatter and lines in multi-trace charts,10.0,0.21112372304199772,0.4468864468864469,0.4441391941391941
3311,Implement RFC-262,2.0,0.38819523269012485,0.44047619047619047,0.4413919413919414
3312,Deploy validate_drp F16 work to Jenkins validate_drp Job,1.4,0.9125993189557321,0.6565934065934066,0.6538461538461539
3313,Update DM C++ Style Guide to require override specifier when overriding virtual members,0.2,0.2054483541430193,0.21428571428571427,0.21428571428571427
3314,Update DM C++ Style Guide to enable automatic code layout with clang-format,0.5,0.2054483541430193,0.21428571428571427,0.21428571428571427
3315,Fix position of psf computation for base_SdssShape_psf,1.0,0.29284903518728717,0.2078754578754579,0.2078754578754579
3316,Fix or remove pickling support for Match lists with pybind11,2.0,0.2054483541430193,0.21428571428571427,0.21428571428571427
3317,Use visitor pattern to clean up afw::table pybind11 wrappers,6.0,0.8286038592508513,0.8232600732600732,0.8232600732600732
3318,Modifying the content of the docs of two Tasks to make them 'user-ready' ,8.0,0.014755959137343927,0.01282051282051282,0.01282051282051282
3319,Jupyter widget design discussion and guideline,10.0,0.24971623155505107,0.4468864468864469,0.4441391941391941
3320,Bug fixes in Firefly/SUIT code,60.0,0.24971623155505107,0.4468864468864469,0.4441391941391941
3321,DS9 region support document,6.0,0.024971623155505107,0.4468864468864469,0.4441391941391941
3322,HSC data: understanding and searching it in PDAC v2 portal (f17),30.0,0.24971623155505107,0.4468864468864469,0.4441391941391941
3323,Alert subscription system beta ,100.0,0.24971623155505107,0.4468864468864469,0.4441391941391941
3324,Flesh out topic templates,8.0,0.014755959137343927,1.0,1.0
3325,Make swim lane diagram for AP mock,5.0,0.4108967082860386,0.27014652014652013,0.27014652014652013
3326,Integrate apmock with OCS system,10.0,0.4108967082860386,0.27014652014652013,0.27014652014652013
3327,New features in PDAC v2 (F17),80.0,0.24971623155505107,0.4468864468864469,0.4441391941391941
3328,SCons pybind11 builds re-link unnecessarily,6.0,0.8286038592508513,0.9807692307692307,0.9807692307692307
3329,Publish display_firefly to eups,2.0,0.094211123723042,0.0695970695970696,0.06868131868131869
3330,XLDB - strategic positioning,3.0,0.5743473325766175,0.9459706959706959,0.5815018315018315
3331,"LSP work: workspace, docker ...",50.0,0.24971623155505107,0.4468864468864469,0.4441391941391941
3332,SUIT  portal bug fixes and code refactoring ,30.0,0.24971623155505107,0.4468864468864469,0.4441391941391941
3333,PDAC v3 part 2,30.0,0.0,0.4468864468864469,0.4441391941391941
3334,"Performance improvement, resolve issues found by loadtest",50.0,0.24971623155505107,0.4468864468864469,0.4441391941391941
3335,"Performance improvement, resolve issues found by loadtest",100.0,0.24971623155505107,0.4468864468864469,0.4441391941391941
3336,Firefly new features for F18 ,50.0,0.24971623155505107,0.4468864468864469,0.4441391941391941
3337,New Firefly features in S19,60.0,0.24971623155505107,0.4468864468864469,0.4441391941391941
3338,New visualization features in F19,100.0,0.0,0.4468864468864469,0.4441391941391941
3339,W'14 newinstall.sh picks up wrong python?,1.0,0.0,0.0009157509157509158,0.0009157509157509158
3340,"Bug fixes, improvements, and code refactoring in SUIT S19",100.0,0.0,0.4468864468864469,0.4441391941391941
3341,Firefly code refactor and bug fixes (S19),100.0,0.24971623155505107,0.4468864468864469,0.4441391941391941
3342,PDAC v4 part2,50.0,0.24971623155505107,0.4468864468864469,0.4441391941391941
3343,"pipelineQA work v2, part2",50.0,0.24971623155505107,0.4468864468864469,0.4441391941391941
3344,"pieplineQA work v3, part2",50.0,0.24971623155505107,0.4468864468864469,0.4441391941391941
3345,"pipelineQA work, v3",100.0,0.24971623155505107,0.4468864468864469,0.4441391941391941
3346,Bug fixes in SUIT and pipelineQA (S20),100.0,0.24971623155505107,0.4468864468864469,0.4441391941391941
3347,Bug fixes in SUIT and pipelineQA (F20),100.0,0.24971623155505107,0.4468864468864469,0.4441391941391941
3348,lsst_dm_stack_demo,40.0,0.015891032917139614,0.015567765567765568,0.015567765567765568
3349,eliminate jointcal compile warnings,2.0,0.5675368898978433,0.5009157509157509,0.5009157509157509
3350,Fix skipped testPickle in testSourceTable.py,2.0,1.0,0.8232600732600732,0.8232600732600732
3351,Attend Camera visualization meeting weekly (Jan. 2017),2.0,0.21112372304199772,0.4468864468864469,0.4441391941391941
3352,Attend Camera visualization meeting weekly (Mar.. 2017),1.5,0.21112372304199772,0.4468864468864469,0.4441391941391941
3353,Attend Camera visualization meeting weekly (Apr. 2017),2.0,0.21112372304199772,0.4468864468864469,0.4441391941391941
3354,Attend Camera visualization meeting weekly (May 2017),2.0,0.21112372304199772,0.4468864468864469,0.4441391941391941
3355,monthly test of tickets related to UI changes and bug fixes (Jan. 2017),5.0,0.024971623155505107,0.4468864468864469,0.4441391941391941
3356,monthly test of tickets related to UI changes and bug fixes (Feb. 2017),5.0,0.024971623155505107,0.4468864468864469,0.4441391941391941
3357,monthly test of tickets related to UI changes and bug fixes (Mar. 2017),0.5,0.024971623155505107,0.4468864468864469,0.4441391941391941
3358,monthly test of tickets related to UI changes and bug fixes (Apr. 2017),5.0,0.024971623155505107,0.4468864468864469,0.4441391941391941
3359,monthly test of tickets related to UI changes and bug fixes (May 2017),5.0,0.024971623155505107,0.4468864468864469,0.4441391941391941
3360,WISE single epoch source table integration(f17),10.0,0.24971623155505107,0.4468864468864469,0.4441391941391941
3361,SUIT integration and test ,40.0,0.24971623155505107,0.4468864468864469,0.4441391941391941
3362,SUIT(portal aspect) integration and test  in LSP deployment ,50.0,0.24971623155505107,0.4468864468864469,0.4441391941391941
3363,"SUIT integration and test for PDAC, pipelineQA ",80.0,0.24971623155505107,0.4468864468864469,0.4441391941391941
3364,SUIT integration and test  S20,100.0,0.24971623155505107,0.4468864468864469,0.4441391941391941
3365,SUIT integration and test F20,100.0,0.24971623155505107,0.4468864468864469,0.4441391941391941
3366,Firefly Python interfaces ,65.0,0.24971623155505107,0.4468864468864469,0.4441391941391941
3367,Python API and widget development to support visualization needs for Science Platform,50.0,0.0,0.4468864468864469,0.4441391941391941
3368,Jupyter widget development to support visualization needs,40.0,0.0,0.4468864468864469,0.4441391941391941
3369,Python API and Jupyter widget development to support visualization needs,50.0,0.24971623155505107,0.4468864468864469,0.4441391941391941
3370,Jupyter widget development to support pipelineQA and visualization needs,50.0,0.0,0.4468864468864469,0.4441391941391941
3371,development for commissioning DAC,160.0,0.24971623155505107,0.4468864468864469,0.4441391941391941
3372,development for commissioning DAC - part2,130.0,0.24971623155505107,0.4468864468864469,0.4441391941391941
3373,DAC deployment,130.0,0.24971623155505107,0.4468864468864469,0.4441391941391941
3374, lsst-dm-mac.lsst.org is inaccessible,0.5,0.13393870601589103,0.4065934065934066,0.4065934065934066
3375,Add parameters to squash dashboard,2.0,0.7298524404086265,0.6071428571428571,0.608058608058608
3376,Create chatops service to monitor QA metric values,4.0,0.8649262202043133,0.6071428571428571,0.608058608058608
3377,Deploy squash change required by SQuaRE Bot ,2.25,0.5550510783200908,0.5576923076923077,0.5576923076923077
3378,Improvements to diffim testing suite,8.0,0.09194097616345062,0.0695970695970696,0.0695970695970696
3379,Forced photometry and better assessments of diffim algorithms on simulations,12.0,0.09194097616345062,0.0695970695970696,0.0695970695970696
3380,More realistic PSFs in simulated images for diffim testing suite,8.0,0.09194097616345062,0.0695970695970696,0.0695970695970696
3381,Ingest HiTS calibration products and test on raw images,4.0,0.20998864926220204,0.09523809523809523,0.09432234432234432
3382,Document the work done on AP Pipeline so far,4.0,0.20998864926220204,0.09523809523809523,0.09432234432234432
3383,Produce calexps from raw HiTS dataset,6.0,0.20998864926220204,0.09523809523809523,0.09432234432234432
3384,Write and test iterative solution,6.0,0.40408626560726446,0.4706959706959707,0.4697802197802198
3385,Use standard difference image for iterative DCR solution,3.0,0.40408626560726446,0.4706959706959707,0.4697802197802198
3386,lsst-dev01 weeklies should include 2017 builds,1.0,0.7582292849035187,1.0,1.0
3387,Migrate Qserv provisioning scripts to heat,8.0,0.4177071509648127,0.3543956043956044,0.3543956043956044
3388,Metaclass for wrapped-template ABCs and class extension decorators,4.0,0.8286038592508513,0.9807692307692307,0.9807692307692307
3389,Remove trailing whitespace from boilerplate,0.5,0.4699205448354143,0.4358974358974359,0.4358974358974359
3390,Add warning about *Lib.py files,0.5,0.4699205448354143,0.4358974358974359,0.4358974358974359
3391,Make SConscript code snippets consistent,0.5,0.4699205448354143,0.4358974358974359,0.4358974358974359
3392,Minor cleanup of build_templates.py,0.5,1.0,0.8232600732600732,0.8232600732600732
3393,Deprecate DMTN-026,1.0,0.3337116912599319,0.8232600732600732,0.8232600732600732
3394,Refactor diffim tests code (simulations for algorithm testing),4.0,0.09194097616345062,0.0695970695970696,0.0695970695970696
3395,User Interface to emulate OCS,8.0,0.19977298524404086,0.14652014652014653,0.14652014652014653
3396,Implement Archive Controller,12.0,0.19977298524404086,0.14652014652014653,0.14652014652014653
3397,Testing archiving system in prep for this integration activity,22.0,0.19977298524404086,0.14652014652014653,0.14652014652014653
3398,Build command and event listeners that integrate with Level One messaging topology,34.0,0.19296254256526674,0.14652014652014653,0.14652014652014653
3399,Port DMTN-017 LaTeX document to technote platform,1.0,0.9125993189557321,0.6565934065934066,0.6538461538461539
3400,build_templates incorrectly adds a blank namespace,1.0,0.3337116912599319,0.2600732600732601,0.2600732600732601
3401,Research existing tools for monitoring,4.0,0.06583427922814983,0.03205128205128205,0.03205128205128205
3402,Segmentation fault from writing dotted FITS header keywords,4.0,0.7582292849035187,0.13278388278388278,0.13278388278388278
3403,Implement alert_stream monitoring tool,10.0,0.06583427922814983,0.03205128205128205,0.03205128205128205
3404,Draft alert distribution tests,6.0,0.06583427922814983,0.03205128205128205,0.03205128205128205
3405,Fix octal umask handling in ctrl_pool,1.0,0.5675368898978433,0.5009157509157509,0.5009157509157509
3406,Create Pegasus plugin for Orca,16.0,0.4188422247446084,0.23443223443223443,0.21245421245421245
3407,Remove Logger dependency and deprecated plugins from Orchestration,4.0,0.4188422247446084,0.23443223443223443,0.21245421245421245
3408,"cannot run singleFrameDriver on hsc data with python3 due to ""__builtin__.str"" in *Mapper.paf",1.0,0.5675368898978433,0.5009157509157509,0.5009157509157509
3409,Allow keeping .i files in build_templates.py,0.5,1.0,0.8232600732600732,0.8232600732600732
3410,Support proper motions in reference catalogs,14.0,1.0,0.13278388278388278,0.13278388278388278
3411,Fix accounting for fraction of successful measurements,1.0,0.11577752553916004,0.09615384615384616,0.09615384615384616
3412,Investigate using NMF for deblender,6.0,0.3337116912599319,0.2600732600732601,0.2600732600732601
3413,Butler mapper issue in validate_drp since Jenkins build 663,1.0,0.7582292849035187,0.6565934065934066,0.6538461538461539
3414,Creates a basic download dialog based on selected rows.,6.0,0.2383654937570942,0.07692307692307693,0.07875457875457875
3415,Implement versioning in SQuaSH REST API,1.4,0.7298524404086265,0.5576923076923077,0.5576923076923077
3416,"Reference catalog proper motions, parallaxes and errors",40.0,0.7582292849035187,0.44047619047619047,0.4413919413919414
3417,Create a Unit test for ImageHeader class,2.0,0.10556186152099886,0.047619047619047616,0.04945054945054945
3418,ci_hsc is broken,1.0,0.16572077185017026,0.13278388278388278,0.13278388278388278
3419,"LeastSqFitter1d(..., unsigned int order) should be signed",0.5,0.20998864926220204,0.8232600732600732,0.8232600732600732
3420,Initial discussions with DM Project Engineer about files in LSST,6.0,0.1543700340522134,0.1163003663003663,0.09340659340659341
3421,Create a Unit test for ImagePlot class,2.0,0.10556186152099886,0.047619047619047616,0.04945054945054945
3422,Create a Unit test for Rotate class,5.0,0.10556186152099886,0.047619047619047616,0.04945054945054945
3423,Wrap datarel with pybind11,0.5,0.2054483541430193,0.21428571428571427,0.21428571428571427
3424,Wrap ctrl_pool with pybind11,0.1,0.2054483541430193,0.21428571428571427,0.21428571428571427
3425,Wrap ctrl_platform_gordon with pybind11,0.1,0.2054483541430193,0.21428571428571427,0.21428571428571427
3426,Optimize template engine used in configuration tool,4.0,0.0,0.3543956043956044,0.3543956043956044
3427,Wrap ctrl_platform_lsst with pybind11,0.1,0.2054483541430193,0.21428571428571427,0.21428571428571427
3428,Wrap ctrl_execute with pybind11,0.1,0.2054483541430193,0.21428571428571427,0.21428571428571427
3429,Disable locking in shared-stack.py,1.0,0.7582292849035187,1.0,1.0
3430,Wrap ctrl_orca with pybind11,0.1,0.2054483541430193,0.21428571428571427,0.21428571428571427
3431,Wrap display_ds9 with pybind11,3.0,1.0,0.21428571428571427,0.21428571428571427
3432,Wrap ctrl_provenance with pybind11,0.1,0.2054483541430193,0.21428571428571427,0.21428571428571427
3433,Wrap shapelet with pybind11,5.0,0.2054483541430193,0.21428571428571427,0.21428571428571427
3434,Wrap skymap with pybind11,2.0,1.0,0.21428571428571427,0.21428571428571427
3435,First round of requirements mapped to vendor products,20.0,0.2122587968217934,0.13003663003663005,0.13003663003663005
3436,GPFS operations and monitoring,10.0,0.3166855845629966,0.13003663003663005,0.13003663003663005
3437,Plan announcement and follow up nagging,5.0,0.17480136208853575,0.13003663003663005,0.13003663003663005
3438,Determine necessary hardware components and connections,1.0,0.03859250851305335,0.13003663003663005,0.13003663003663005
3439,Upgrade pybind11 to version 2.x,2.0,0.2054483541430193,0.21428571428571427,0.21428571428571427
3440,Add height of CCDs to camera geometry specification,6.0,0.11577752553916004,0.08516483516483517,0.08424908424908426
3441,Investigate if  MariaDB 10.1+ DynamicField() can be used for storing JSON blobs,2.0,0.7298524404086265,0.5576923076923077,0.5576923076923077
3442,Document microservice creation for api.lsst.codes,4.0,0.8649262202043133,0.6071428571428571,0.608058608058608
3443,Deeper understanding of what exactly jointcal is doing,30.0,0.40408626560726446,0.5009157509157509,0.5009157509157509
3444,Use Gaia to compare absolute astrometry post-jointcal on HSC,8.0,0.5675368898978433,0.5009157509157509,0.5009157509157509
3445,Create new HSC calibs,4.0,0.16572077185017026,0.13278388278388278,0.13278388278388278
3446,Improve container build in Jenkins,5.0,0.4177071509648127,0.3543956043956044,0.3543956043956044
3447,jenkins slave segv,0.75,0.5550510783200908,0.4065934065934066,0.4065934065934066
3448,Write JUNIT test cases for IPAC table reading,10.0,0.024971623155505107,0.0173992673992674,0.0173992673992674
3449,Evaluate time series enterprise monitoring platforms,4.0,0.07377979568671963,0.8745421245421245,0.9010989010989011
3450,Install and configure monitoring platform and client,4.0,0.07377979568671963,0.8745421245421245,0.9010989010989011
3451,Prototype LSST system monitoring dashboard,4.0,0.07377979568671963,0.8745421245421245,0.9010989010989011
3452,remove jenkins hipchat notifications,1.0,0.5550510783200908,0.4065934065934066,0.4065934065934066
3453,Configure and test performance thresholds,4.0,0.07377979568671963,0.8745421245421245,0.9010989010989011
3454,Incorporate additional services into the service catalog,13.0,0.07377979568671963,0.8745421245421245,0.9010989010989011
3455,Incorporate information security plan into service catalog,12.0,0.07377979568671963,0.8745421245421245,0.9010989010989011
3456,First-order reconciliation of internal service architecture with high-level services,14.0,0.07377979568671963,0.8745421245421245,0.9010989010989011
3457,Install supporting services,12.0,0.2122587968217934,0.8745421245421245,0.9010989010989011
3458,Design transfer mechanism for DR tool.,5.0,0.2122587968217934,0.8745421245421245,0.9010989010989011
3459,Monitor Globus transfer tasks,14.0,0.2122587968217934,0.8745421245421245,0.9010989010989011
3460,Process refinement and improvement.,10.0,0.2122587968217934,0.8745421245421245,0.9010989010989011
3461,Service Management & Emergent Work  (December) ,5.0,0.17480136208853575,0.09065934065934066,0.09065934065934066
3462,Change SQuaSH to store JSON as a BLOB/TEXT in MariaDB 10.1+,2.8,0.7298524404086265,0.5576923076923077,0.5576923076923077
3463,DM-wide replanning - December: further development of NCSA WBS,80.0,0.1112372304199773,0.3076923076923077,0.3067765567765568
3464,"Ops planning - December: assess reviewers feedback, consider descope options ",10.0,0.1112372304199773,0.3076923076923077,0.3067765567765568
3465,Commissioning planning - December: contributions to commissioning plan document,10.0,0.060158910329171394,0.3076923076923077,0.3067765567765568
3466,Ops planning - January,10.0,0.1112372304199773,0.3076923076923077,0.3067765567765568
3467,Commissioning planning - January,12.0,0.060158910329171394,0.3076923076923077,0.3067765567765568
3468,DM-wide replanning - January,60.0,0.1112372304199773,0.3076923076923077,0.3067765567765568
3469,migrate squash production DB to MariaDB 10.1.x,0.5,0.5550510783200908,0.4065934065934066,0.4065934065934066
3470,purge unused jenkins plugins / fully manage all plugins,2.333,0.5550510783200908,0.4065934065934066,0.4065934065934066
3471,jenkins master unstable,2.5,0.5550510783200908,0.4065934065934066,0.4065934065934066
3472,Remove dependency on CAT package and make database setup optional,4.0,0.4188422247446084,0.23443223443223443,0.21245421245421245
3473,ctrl_stats fails tests in 2017,1.0,0.4188422247446084,0.7976190476190477,0.7994505494505495
3474,ctrl_stats doesn't calculate year to next year progress properly,8.0,0.4188422247446084,0.23443223443223443,0.21245421245421245
3475,Use an existing qserv_run_dir with a new Qserv instance/binary,4.0,0.4177071509648127,0.3543956043956044,0.3543956043956044
3476,evaluate creation / installation of eups distrib 'tarball' packages,1.3330000000000002,0.5550510783200908,0.4065934065934066,0.4065934065934066
3477,Add TE1 and TE2 KPMs to validate_drp using code developed in DM-3040,10.0,0.11577752553916004,0.09615384615384616,0.09615384615384616
3478,Plot the data flow of a jointcal example,3.0,0.49375709421112374,0.43956043956043955,0.43864468864468864
3479,Plan Prototype Warped Image Comparision,10.0,0.300794551645857,0.43315018315018317,0.43315018315018317
3480,Update developer guide to describe package build directory,1.0,0.08626560726447219,0.5009157509157509,0.5009157509157509
3481,Update eupspkg to support _build/ directory,4.0,0.9897843359818388,0.5009157509157509,0.5009157509157509
3482,Update existing packages to reflect _build/ directory and .gitignore entries,2.0,0.0,0.5009157509157509,0.5009157509157509
3483,Original plot does not abort and over writes active plot,5.0,0.27809307604994327,0.0173992673992674,0.0173992673992674
3484,Change warpImage and warpExposure to take shared_ptrs,2.0,0.0,0.9807692307692307,0.9807692307692307
3485,Create NMF deblender plugin,16.0,0.3337116912599319,0.2600732600732601,0.2600732600732601
3486,fix lsst-sims installation instructions on pipelines.lsst.io,0.2,0.9125993189557321,0.019230769230769232,0.019230769230769232
3487,Set darktime in makeRawVisitInfo,0.5,0.16572077185017026,0.13278388278388278,0.13278388278388278
3488,Update singleFrameDriver following changes to reference catalogs,0.5,0.16572077185017026,0.13278388278388278,0.13278388278388278
3489,Extend Alert Production prototype with new index type,8.0,0.4733257661748014,0.23809523809523808,0.23626373626373626
3490,Performance plots with AP prototype on SSD,4.0,0.4733257661748014,0.23809523809523808,0.23626373626373626
3491,Documenting using emoji reactions in GitHub code reviews,0.5,0.9125993189557321,0.6565934065934066,0.6538461538461539
3492,Create deprecation decorator and doc update,4.0,0.08626560726447219,0.2600732600732601,0.2600732600732601
3493,Add deprecation procedure to dev guide,1.0,0.08626560726447219,0.2600732600732601,0.2600732600732601
3494,Small bug in describing the usesimplePsf config var for charImgTask ,1.0,0.7582292849035187,0.01282051282051282,0.01282051282051282
3495,Create cookiecutter template for api.lsst.codes microservices,3.0,0.8649262202043133,0.6071428571428571,0.608058608058608
3496,obs_cfht table file uses envAppend,1.0,0.16572077185017026,0.13278388278388278,0.13278388278388278
